# smartctl -a /dev/sdh
smartctl 7.2 2020-12-30 r5155 [x86_64-linux-5.10.0-7-amd64] (local build)
Copyright (C) 2002-20, Bruce Allen, Christian Franke, www.smartmontools.org

=== START OF INFORMATION SECTION ===
Model Family:     Western Digital Caviar Blue (SATA)
Device Model:     WDC WD6400AAKS-65A7B0
Serial Number:    WD-WMASY1529312
LU WWN Device Id: 5 0014ee 000a56023
Firmware Version: 01.03B01
User Capacity:    640,135,028,736 bytes [640 GB]
Sector Size:      512 bytes logical/physical
Device is:        In smartctl database [for details use: -P show]
ATA Version is:   ATA8-ACS (minor revision not indicated)
SATA Version is:  SATA 2.5, 3.0 Gb/s
Local Time is:    Fri Jul 23 13:25:53 2021 CEST
SMART support is: Available - device has SMART capability.
SMART support is: Enabled

=== START OF READ SMART DATA SECTION ===
SMART overall-health self-assessment test result: PASSED

General SMART Values:
Offline data collection status:  (0x82)	Offline data collection activity
					was completed without error.
					Auto Offline Data Collection: Enabled.
Self-test execution status:      (   0)	The previous self-test routine completed
					without error or no self-test has ever 
					been run.
Total time to complete Offline 
data collection: 		(12000) seconds.
Offline data collection
capabilities: 			 (0x7b) SMART execute Offline immediate.
					Auto Offline data collection on/off support.
					Suspend Offline collection upon new
					command.
					Offline surface scan supported.
					Self-test supported.
					Conveyance Self-test supported.
					Selective Self-test supported.
SMART capabilities:            (0x0003)	Saves SMART data before entering
					power-saving mode.
					Supports SMART auto save timer.
Error logging capability:        (0x01)	Error logging supported.
					General Purpose Logging supported.
Short self-test routine 
recommended polling time: 	 (   2) minutes.
Extended self-test routine
recommended polling time: 	 ( 140) minutes.
Conveyance self-test routine
recommended polling time: 	 (   5) minutes.
SCT capabilities: 	       (0x303f)	SCT Status supported.
					SCT Error Recovery Control supported.
					SCT Feature Control supported.
					SCT Data Table supported.

SMART Attributes Data Structure revision number: 16
Vendor Specific SMART Attributes with Thresholds:
ID# ATTRIBUTE_NAME          FLAG     VALUE WORST THRESH TYPE      UPDATED  WHEN_FAILED RAW_VALUE
  1 Raw_Read_Error_Rate     0x002f   200   200   051    Pre-fail  Always       -       0
  3 Spin_Up_Time            0x0027   155   150   021    Pre-fail  Always       -       5216
  4 Start_Stop_Count        0x0032   094   094   000    Old_age   Always       -       6665
  5 Reallocated_Sector_Ct   0x0033   200   200   140    Pre-fail  Always       -       0
  7 Seek_Error_Rate         0x002e   200   200   051    Old_age   Always       -       0
  9 Power_On_Hours          0x0032   091   091   000    Old_age   Always       -       6889
 10 Spin_Retry_Count        0x0032   100   100   051    Old_age   Always       -       0
 11 Calibration_Retry_Count 0x0032   100   100   051    Old_age   Always       -       0
 12 Power_Cycle_Count       0x0032   098   098   000    Old_age   Always       -       2128
192 Power-Off_Retract_Count 0x0032   200   200   000    Old_age   Always       -       177
193 Load_Cycle_Count        0x0032   198   198   000    Old_age   Always       -       6638
194 Temperature_Celsius     0x0022   113   093   000    Old_age   Always       -       34
196 Reallocated_Event_Count 0x0032   200   200   000    Old_age   Always       -       0
197 Current_Pending_Sector  0x0032   200   200   000    Old_age   Always       -       0
198 Offline_Uncorrectable   0x0030   200   200   000    Old_age   Offline      -       0
199 UDMA_CRC_Error_Count    0x0032   200   200   000    Old_age   Always       -       0
200 Multi_Zone_Error_Rate   0x0008   200   200   051    Old_age   Offline      -       0

SMART Error Log Version: 1
No Errors Logged

SMART Self-test log structure revision number 1
Num  Test_Description    Status                  Remaining  LifeTime(hours)  LBA_of_first_error
# 1  Short offline       Completed without error       00%      6889         -
# 2  Short offline       Completed without error       00%      6889         -
# 3  Extended offline    Completed without error       00%      6879         -
# 4  Conveyance offline  Completed without error       00%      6877         -
# 5  Short offline       Completed without error       00%      6858         -
# 6  Short offline       Completed without error       00%      6849         -
# 7  Short offline       Completed without error       00%      6843         -
# 8  Short offline       Completed without error       00%      6829         -
# 9  Short offline       Completed without error       00%      6823         -
#10  Short offline       Completed without error       00%      6822         -
#11  Short offline       Completed without error       00%      6812         -
#12  Short offline       Completed without error       00%      6807         -
#13  Short offline       Completed without error       00%      6799         -
#14  Short offline       Completed without error       00%      6786         -
#15  Short offline       Completed without error       00%      6778         -
#16  Short offline       Completed without error       00%      6766         -
#17  Short offline       Completed without error       00%      6756         -
#18  Short offline       Completed without error       00%      6750         -
#19  Short offline       Completed without error       00%      6739         -
#20  Short offline       Completed without error       00%      6733         -
#21  Short offline       Completed without error       00%      6723         -

SMART Selective self-test log data structure revision number 1
 SPAN  MIN_LBA  MAX_LBA  CURRENT_TEST_STATUS
    1        0        0  Not_testing
    2        0        0  Not_testing
    3        0        0  Not_testing
    4        0        0  Not_testing
    5        0        0  Not_testing
Selective self-test flags (0x0):
  After scanning selected spans, do NOT read-scan remainder of disk.
If Selective self-test is pending on power-up, resume after 0 minute delay.

