# smartctl -a /dev/sdh
smartctl 7.2 2020-12-30 r5155 [x86_64-linux-5.10.0-8-amd64] (local build)
Copyright (C) 2002-20, Bruce Allen, Christian Franke, www.smartmontools.org

=== START OF INFORMATION SECTION ===
Model Family:     Western Digital Caviar Green (AF)
Device Model:     WDC WD10EARS-00Y5B1
Serial Number:    WD-WCAV5W565708
LU WWN Device Id: 5 0014ee 25c89d9f0
Firmware Version: 80.00A80
User Capacity:    1,000,204,886,016 bytes [1.00 TB]
Sector Sizes:     512 bytes logical, 4096 bytes physical
Device is:        In smartctl database [for details use: -P show]
ATA Version is:   ATA8-ACS (minor revision not indicated)
SATA Version is:  SATA 2.6, 3.0 Gb/s
Local Time is:    Sun Aug  8 17:23:24 2021 CEST
SMART support is: Available - device has SMART capability.
SMART support is: Enabled

=== START OF READ SMART DATA SECTION ===
SMART overall-health self-assessment test result: PASSED

General SMART Values:
Offline data collection status:  (0x82)	Offline data collection activity
					was completed without error.
					Auto Offline Data Collection: Enabled.
Self-test execution status:      (   0)	The previous self-test routine completed
					without error or no self-test has ever 
					been run.
Total time to complete Offline 
data collection: 		(20880) seconds.
Offline data collection
capabilities: 			 (0x7b) SMART execute Offline immediate.
					Auto Offline data collection on/off support.
					Suspend Offline collection upon new
					command.
					Offline surface scan supported.
					Self-test supported.
					Conveyance Self-test supported.
					Selective Self-test supported.
SMART capabilities:            (0x0003)	Saves SMART data before entering
					power-saving mode.
					Supports SMART auto save timer.
Error logging capability:        (0x01)	Error logging supported.
					General Purpose Logging supported.
Short self-test routine 
recommended polling time: 	 (   2) minutes.
Extended self-test routine
recommended polling time: 	 ( 240) minutes.
Conveyance self-test routine
recommended polling time: 	 (   5) minutes.
SCT capabilities: 	       (0x3035)	SCT Status supported.
					SCT Feature Control supported.
					SCT Data Table supported.

SMART Attributes Data Structure revision number: 16
Vendor Specific SMART Attributes with Thresholds:
ID# ATTRIBUTE_NAME          FLAG     VALUE WORST THRESH TYPE      UPDATED  WHEN_FAILED RAW_VALUE
  1 Raw_Read_Error_Rate     0x002f   200   200   051    Pre-fail  Always       -       0
  3 Spin_Up_Time            0x0027   189   184   021    Pre-fail  Always       -       6533
  4 Start_Stop_Count        0x0032   100   100   000    Old_age   Always       -       938
  5 Reallocated_Sector_Ct   0x0033   200   200   140    Pre-fail  Always       -       0
  7 Seek_Error_Rate         0x002e   200   200   000    Old_age   Always       -       0
  9 Power_On_Hours          0x0032   094   094   000    Old_age   Always       -       4704
 10 Spin_Retry_Count        0x0032   100   100   000    Old_age   Always       -       0
 11 Calibration_Retry_Count 0x0032   100   100   000    Old_age   Always       -       0
 12 Power_Cycle_Count       0x0032   100   100   000    Old_age   Always       -       765
192 Power-Off_Retract_Count 0x0032   200   200   000    Old_age   Always       -       36
193 Load_Cycle_Count        0x0032   196   196   000    Old_age   Always       -       13870
194 Temperature_Celsius     0x0022   102   099   000    Old_age   Always       -       45
196 Reallocated_Event_Count 0x0032   200   200   000    Old_age   Always       -       0
197 Current_Pending_Sector  0x0032   200   200   000    Old_age   Always       -       0
198 Offline_Uncorrectable   0x0030   200   200   000    Old_age   Offline      -       0
199 UDMA_CRC_Error_Count    0x0032   200   200   000    Old_age   Always       -       36
200 Multi_Zone_Error_Rate   0x0008   200   200   000    Old_age   Offline      -       0

SMART Error Log Version: 1
ATA Error Count: 2
	CR = Command Register [HEX]
	FR = Features Register [HEX]
	SC = Sector Count Register [HEX]
	SN = Sector Number Register [HEX]
	CL = Cylinder Low Register [HEX]
	CH = Cylinder High Register [HEX]
	DH = Device/Head Register [HEX]
	DC = Device Command Register [HEX]
	ER = Error register [HEX]
	ST = Status register [HEX]
Powered_Up_Time is measured from power on, and printed as
DDd+hh:mm:SS.sss where DD=days, hh=hours, mm=minutes,
SS=sec, and sss=millisec. It "wraps" after 49.710 days.

Error 2 occurred at disk power-on lifetime: 843 hours (35 days + 3 hours)
  When the command that caused the error occurred, the device was active or idle.

  After command completion occurred, registers were:
  ER ST SC SN CL CH DH
  -- -- -- -- -- -- --
  04 51 01 00 00 00 00  Error: ABRT

  Commands leading to the command that caused the error were:
  CR FR SC SN CL CH DH DC   Powered_Up_Time  Command/Feature_Name
  -- -- -- -- -- -- -- --  ----------------  --------------------
  b0 d5 01 e1 4f c2 00 08      00:13:07.254  SMART READ LOG
  b0 d5 01 e1 4f c2 00 08      00:13:07.254  SMART READ LOG
  b0 d6 01 e0 4f c2 00 08      00:13:07.254  SMART WRITE LOG
  b0 d6 01 e0 4f c2 00 08      00:13:07.253  SMART WRITE LOG
  b0 d5 01 e0 4f c2 00 08      00:13:07.253  SMART READ LOG

Error 1 occurred at disk power-on lifetime: 279 hours (11 days + 15 hours)
  When the command that caused the error occurred, the device was active or idle.

  After command completion occurred, registers were:
  ER ST SC SN CL CH DH
  -- -- -- -- -- -- --
  04 51 01 00 00 00 00  Error: ABRT

  Commands leading to the command that caused the error were:
  CR FR SC SN CL CH DH DC   Powered_Up_Time  Command/Feature_Name
  -- -- -- -- -- -- -- --  ----------------  --------------------
  b0 d5 01 e1 4f c2 00 08      02:33:58.859  SMART READ LOG
  b0 d5 01 e1 4f c2 00 08      02:33:58.859  SMART READ LOG
  b0 d6 01 e0 4f c2 00 08      02:33:58.858  SMART WRITE LOG
  b0 d6 01 e0 4f c2 00 08      02:33:58.857  SMART WRITE LOG
  b0 d5 01 e0 4f c2 00 08      02:33:58.857  SMART READ LOG

SMART Self-test log structure revision number 1
Num  Test_Description    Status                  Remaining  LifeTime(hours)  LBA_of_first_error
# 1  Short offline       Completed without error       00%      4704         -
# 2  Short offline       Completed without error       00%      4703         -
# 3  Extended offline    Completed without error       00%      4702         -
# 4  Conveyance offline  Completed without error       00%      4699         -
# 5  Short offline       Completed without error       00%      4637         -
# 6  Short offline       Completed without error       00%      4594         -
# 7  Short offline       Completed without error       00%      1021         -
# 8  Short offline       Completed without error       00%      1013         -
# 9  Short offline       Completed without error       00%      1006         -
#10  Short offline       Completed without error       00%       992         -
#11  Short offline       Completed without error       00%       986         -
#12  Short offline       Completed without error       00%       985         -
#13  Short offline       Completed without error       00%       976         -
#14  Short offline       Completed without error       00%       970         -
#15  Short offline       Completed without error       00%       962         -
#16  Short offline       Completed without error       00%       949         -
#17  Short offline       Completed without error       00%       941         -
#18  Short offline       Completed without error       00%       929         -
#19  Short offline       Completed without error       00%       919         -
#20  Short offline       Completed without error       00%       913         -
#21  Short offline       Completed without error       00%       902         -

SMART Selective self-test log data structure revision number 1
 SPAN  MIN_LBA  MAX_LBA  CURRENT_TEST_STATUS
    1        0        0  Not_testing
    2        0        0  Not_testing
    3        0        0  Not_testing
    4        0        0  Not_testing
    5        0        0  Not_testing
Selective self-test flags (0x0):
  After scanning selected spans, do NOT read-scan remainder of disk.
If Selective self-test is pending on power-up, resume after 0 minute delay.

