# smartctl -a /dev/sdb
smartctl 6.6 2017-11-05 r4594 [x86_64-linux-4.19.0-17-amd64] (local build)
Copyright (C) 2002-17, Bruce Allen, Christian Franke, www.smartmontools.org

=== START OF INFORMATION SECTION ===
Model Family:     Western Digital Caviar Blue Serial ATA
Device Model:     WDC WD3200AAJS-65VWA0
Serial Number:    WD-WCARW0477615
LU WWN Device Id: 5 0014ee 155bb1488
Firmware Version: 12.01B02
User Capacity:    320,072,933,376 bytes [320 GB]
Sector Size:      512 bytes logical/physical
Device is:        In smartctl database [for details use: -P show]
ATA Version is:   ATA8-ACS (minor revision not indicated)
SATA Version is:  SATA 2.5, 3.0 Gb/s
Local Time is:    Tue Aug  3 11:25:18 2021 CEST
SMART support is: Available - device has SMART capability.
SMART support is: Enabled

=== START OF READ SMART DATA SECTION ===
SMART overall-health self-assessment test result: PASSED

General SMART Values:
Offline data collection status:  (0x85)	Offline data collection activity
					was aborted by an interrupting command from host.
					Auto Offline Data Collection: Enabled.
Self-test execution status:      (   0)	The previous self-test routine completed
					without error or no self-test has ever 
					been run.
Total time to complete Offline 
data collection: 		( 8760) seconds.
Offline data collection
capabilities: 			 (0x7b) SMART execute Offline immediate.
					Auto Offline data collection on/off support.
					Suspend Offline collection upon new
					command.
					Offline surface scan supported.
					Self-test supported.
					Conveyance Self-test supported.
					Selective Self-test supported.
SMART capabilities:            (0x0003)	Saves SMART data before entering
					power-saving mode.
					Supports SMART auto save timer.
Error logging capability:        (0x01)	Error logging supported.
					General Purpose Logging supported.
Short self-test routine 
recommended polling time: 	 (   2) minutes.
Extended self-test routine
recommended polling time: 	 ( 104) minutes.
Conveyance self-test routine
recommended polling time: 	 (   5) minutes.
SCT capabilities: 	       (0x303f)	SCT Status supported.
					SCT Error Recovery Control supported.
					SCT Feature Control supported.
					SCT Data Table supported.

SMART Attributes Data Structure revision number: 16
Vendor Specific SMART Attributes with Thresholds:
ID# ATTRIBUTE_NAME          FLAG     VALUE WORST THRESH TYPE      UPDATED  WHEN_FAILED RAW_VALUE
  1 Raw_Read_Error_Rate     0x000f   200   200   051    Pre-fail  Always       -       0
  3 Spin_Up_Time            0x0003   160   157   021    Pre-fail  Always       -       4991
  4 Start_Stop_Count        0x0032   095   095   000    Old_age   Always       -       5128
  5 Reallocated_Sector_Ct   0x0033   200   200   140    Pre-fail  Always       -       0
  7 Seek_Error_Rate         0x000e   200   200   051    Old_age   Always       -       0
  9 Power_On_Hours          0x0032   077   077   000    Old_age   Always       -       16934
 10 Spin_Retry_Count        0x0012   100   100   051    Old_age   Always       -       0
 11 Calibration_Retry_Count 0x0012   100   100   051    Old_age   Always       -       0
 12 Power_Cycle_Count       0x0032   097   097   000    Old_age   Always       -       3786
192 Power-Off_Retract_Count 0x0032   200   200   000    Old_age   Always       -       307
193 Load_Cycle_Count        0x0032   199   199   000    Old_age   Always       -       5131
194 Temperature_Celsius     0x0022   117   086   000    Old_age   Always       -       30
196 Reallocated_Event_Count 0x0032   200   200   000    Old_age   Always       -       0
197 Current_Pending_Sector  0x0012   200   200   000    Old_age   Always       -       0
198 Offline_Uncorrectable   0x0010   200   200   000    Old_age   Offline      -       0
199 UDMA_CRC_Error_Count    0x003e   200   200   000    Old_age   Always       -       34
200 Multi_Zone_Error_Rate   0x0008   200   200   051    Old_age   Offline      -       0

SMART Error Log Version: 1
ATA Error Count: 3
	CR = Command Register [HEX]
	FR = Features Register [HEX]
	SC = Sector Count Register [HEX]
	SN = Sector Number Register [HEX]
	CL = Cylinder Low Register [HEX]
	CH = Cylinder High Register [HEX]
	DH = Device/Head Register [HEX]
	DC = Device Command Register [HEX]
	ER = Error register [HEX]
	ST = Status register [HEX]
Powered_Up_Time is measured from power on, and printed as
DDd+hh:mm:SS.sss where DD=days, hh=hours, mm=minutes,
SS=sec, and sss=millisec. It "wraps" after 49.710 days.

Error 3 occurred at disk power-on lifetime: 8095 hours (337 days + 7 hours)
  When the command that caused the error occurred, the device was active or idle.

  After command completion occurred, registers were:
  ER ST SC SN CL CH DH
  -- -- -- -- -- -- --
  04 51 0b 00 00 00 00  Error: ABRT

  Commands leading to the command that caused the error were:
  CR FR SC SN CL CH DH DC   Powered_Up_Time  Command/Feature_Name
  -- -- -- -- -- -- -- --  ----------------  --------------------
  b0 d5 01 e1 4f c2 00 08      07:08:30.472  SMART READ LOG
  b0 d5 01 e1 4f c2 00 08      07:08:30.472  SMART READ LOG
  b0 d6 01 e0 4f c2 00 08      07:08:30.471  SMART WRITE LOG
  b0 d6 01 e0 4f c2 00 08      07:08:30.471  SMART WRITE LOG
  b0 d5 01 e0 4f c2 00 08      07:08:30.470  SMART READ LOG

Error 2 occurred at disk power-on lifetime: 8095 hours (337 days + 7 hours)
  When the command that caused the error occurred, the device was active or idle.

  After command completion occurred, registers were:
  ER ST SC SN CL CH DH
  -- -- -- -- -- -- --
  04 51 0b 00 00 00 00  Error: ABRT

  Commands leading to the command that caused the error were:
  CR FR SC SN CL CH DH DC   Powered_Up_Time  Command/Feature_Name
  -- -- -- -- -- -- -- --  ----------------  --------------------
  b0 d5 01 e1 4f c2 00 08      07:05:36.228  SMART READ LOG
  b0 d6 01 e0 4f c2 00 08      07:05:36.227  SMART WRITE LOG
  b0 d6 01 e0 4f c2 00 08      07:05:36.227  SMART WRITE LOG
  2f 00 01 11 00 00 00 08      07:05:36.226  READ LOG EXT
  b0 d5 01 e0 4f c2 00 08      07:05:36.226  SMART READ LOG

Error 1 occurred at disk power-on lifetime: 8095 hours (337 days + 7 hours)
  When the command that caused the error occurred, the device was active or idle.

  After command completion occurred, registers were:
  ER ST SC SN CL CH DH
  -- -- -- -- -- -- --
  04 51 0b 00 00 00 00  Error: ABRT

  Commands leading to the command that caused the error were:
  CR FR SC SN CL CH DH DC   Powered_Up_Time  Command/Feature_Name
  -- -- -- -- -- -- -- --  ----------------  --------------------
  b0 d5 01 e1 4f c2 00 08      07:05:36.226  SMART READ LOG
  b0 d5 01 09 4f c2 00 08      07:05:36.225  SMART READ LOG
  b0 d6 01 e0 4f c2 00 08      07:05:36.225  SMART WRITE LOG
  b0 d6 01 e0 4f c2 00 08      07:05:36.223  SMART WRITE LOG
  2f 00 01 07 00 00 00 08      07:05:36.223  READ LOG EXT

SMART Self-test log structure revision number 1
Num  Test_Description    Status                  Remaining  LifeTime(hours)  LBA_of_first_error
# 1  Short offline       Completed without error       00%     16934         -
# 2  Short offline       Completed without error       00%     16931         -
# 3  Extended offline    Completed without error       00%     16931         -
# 4  Conveyance offline  Completed without error       00%     16929         -
# 5  Short offline       Completed without error       00%     16883         -
# 6  Short offline       Completed without error       00%     16840         -
# 7  Short offline       Completed without error       00%      8507         -
# 8  Short offline       Completed without error       00%      8503         -
# 9  Short offline       Completed without error       00%      8493         -
#10  Short offline       Completed without error       00%      8478         -
#11  Short offline       Completed without error       00%      8442         -
#12  Short offline       Completed without error       00%      8429         -
#13  Short offline       Completed without error       00%      8426         -
#14  Short offline       Completed without error       00%      8419         -
#15  Short offline       Completed without error       00%      8405         -
#16  Short offline       Completed without error       00%      8376         -
#17  Short offline       Completed without error       00%      8347         -
#18  Short offline       Completed without error       00%      8342         -
#19  Short offline       Completed without error       00%      8331         -
#20  Short offline       Completed without error       00%      8320         -
#21  Short offline       Completed without error       00%      8319         -

SMART Selective self-test log data structure revision number 1
 SPAN  MIN_LBA  MAX_LBA  CURRENT_TEST_STATUS
    1        0        0  Not_testing
    2        0        0  Not_testing
    3        0        0  Not_testing
    4        0        0  Not_testing
    5        0        0  Not_testing
Selective self-test flags (0x0):
  After scanning selected spans, do NOT read-scan remainder of disk.
If Selective self-test is pending on power-up, resume after 0 minute delay.

